title,content,publishedAt
Cathie Wood Loads Up On This Tesla Rival As Elon Musk's EV Giant Gears Up For Q3 Earnings - BYD (OTC:BYDDY),"On Tuesday, Cathie Wood-led Ark Invest made a significant move by purchasing shares of BYD Co Ltd (OTC:BYDDY). This decision comes shortly after the Chinese electric vehicle manufacturer announced a recall of over 115,000 vehicles due to battery-related safety issues.

The BYD Trade

The Trade was executed through Ark's ARK Autonomous Technology & Robotics ETF (BATS:ARKQ). The fund acquired 55,523 shares of BYD Co Ltd, valued at approximately $737,900 based on the latest closing price of $13.29. This purchase increases Ark's exposure to the electric vehicle sector, despite recent challenges faced by BYD.

BYD recently faced a setback when it issued a recall for more than 115,000 vehicles, including the Tang and Yuan Pro series, due to potential battery safety risks. The recall was prompted by design defects that could lead to circuit board corrosion, posing safety hazards.

Despite these issues, Ark Invest's decision to buy more shares indicates a likely continued belief in BYD's long-term potential in the EV market.

It should be noted that on Monday, Ark had purchased 69,000 BYD shares worth $941,850 through ARKQ. Wood is considered bullish on BYD-rival Tesla Inc. (NASDAQ:TSLA). She has called Tesla CEO Elon Musk ""the most productive human being on Earth and in space in history."" Tesla is Ark Invest's largest holding, with its stake valued at nearly $1.5 billion. Across Wood's family of ETFs, Tesla accounts for a combined portfolio weight of about 9.94%. The Musk-led company is scheduled to release third-quarter results on Wednesday after the market close.

Benzinga's Edge Stock Rankings show that BYD's principal rival, Tesla, has a Value in the 3rd percentile. Here is how other major EV players stack up.

Read Next:

Ray Dalio Unveils His AI Clone To Have Unlimited Conversations: 'What It Can Do Is...'

Photo Courtesy: PJ McDonnell on Shutterstock.com

This story was generated using Benzinga Neuro and edited by Shivdeep Dhaliwal

BYDDYBYD Co Ltd$13.29-2.64%OverviewARKQARK Autonomous Technology & Robotics ETF$119.480.39%TSLATesla Inc$441.75-1.27%Market News and Data brought to you by Benzinga APIs",2025-10-22
Wall St futures dip after Dow gains on upbeat earnings; Netflix results disappoint By Investing.com,"Investing.com-- U.S. stock futures edged lower on Tuesday evening after Wall Street ended mixed, with strong quarterly results from major industrials lifting the Dow, while weakness in tech shares weighed on the Nasdaq.

S&P 500 Futures inched 0.1% lower to 6,768.50 points, while Nasdaq 100 Futures fell 0.2% to 25,232.75 points by 20:28 ET (00:28 GMT). Dow Jones Futures dipped 0.1% to 47,112.0 points.

Dow gains on upbeat corporate earnings; CPI data eyed

In Tuesday's regular session, the Dow Jones Industrial Average ended 0.5% higher after hitting a record high during the day, boosted by upbeat earnings from companies such as General Motors, 3M, and GE Aerospace.

The S&P 500 closed largely flat, while the NASDAQ Composite slipped 0.2% as some technology and growth stocks lost momentum.

General Motors (NYSE:GM) shares surged nearly 15% after the automaker raised its full-year forecast, citing resilient demand.

GE Aerospace (NYSE:GE) gained after posting stronger-than-expected quarterly results and lifting its outlook, while 3M Company (NYSE:MMM) rose around 8% after improving its profit forecast.

Coca-Cola (NYSE:KO) shares advanced over 4% after the beverage maker reported solid third-quarter demand and revenue growth.

Investors are now turning their attention to Friday's U.S. Consumer Price Index data, which could cement expectations for a Federal Reserve interest rate cut at its October meeting.

The shutdown of large parts of the federal government is complicating data flows and could cloud the inflation signal. The gridlock, now entering its fourth week, has delayed or paused key economic data releases, adding uncertainty.

Netflix, Mattel slip on weak results; Tesla on tap

In after-hours trading, Netflix (NASDAQ:NFLX) shares slipped more than 6% after the company posted disappointing quarterly results, citing an ongoing dispute with Brazilian tax authorities.

Mattel Inc (NASDAQ:MAT) shares dropped 5% in post-market hours, after missing estimates and reporting weaker North American sales.

Attention will now shift to a fresh slate of corporate earnings later this week, with Tesla Inc (NASDAQ:TSLA) due to report on Wednesday, followed by Intel Corporation (NASDAQ:INTC), Amazon (NASDAQ:AMZN), and other major companies in the coming days.",2025-10-22
"Tesla (NASDAQ: TSLA) Bull, Base and Bear Price Prediction and Forecast","Shares of Tesla Inc. (NASDAQ:TSLA) gained 4.07% over the past five trading sessions after losing 4.84% the five prior. A rally that began in early summer has finally pushed the stock into the green on the year with a gain of 17.02%. Still, since hitting its all-time high on Dec. 17, 2024, the stock has fallen 7.54%. When the company last reported earnings in July, it announced that in Q2, revenues were down 12% year over year (YoY), EPS was down 23% YoY, operating income was down 42% YoY and vehicle deliveries fell to 384,122 -- down 14% YoY. Since launching in India in mid-July, Tesla has only received a paltry 600 orders.

Indeed, Tesla's stock has gone through vicious crashes before. And while the stock may not be ready to shift gears from reverse to forward, I do think that a worsening of its latest drawdown could prove a significant buying opportunity, given the chance its drivers could pay off at some point over the medium term. Undoubtedly, the bears may be winning the tug-of-war on the stock now, as Elon Musk's role at DOGE (Department of Government Efficiency) becomes old news as hype surrounding Musk's friendship with Trump begins to fade. However, with EV competition mounting and a Jeff Bezos-backed startup entering the scene, Tesla's outlook remains clouded.

In any case, 24/7 Wall St. dove into the lengthy list of drivers and potholes that investors should look forward to (or fasten their seatbelts for) in the coming year and beyond. Let's check out a bull, bear, and base case for the EV titan and have a glimpse at the varied viewpoints of multiple Wall Street pros. In fact, Tesla stock has a ton of table-pounding bulls in addition to massive bears. While not everyone is the biggest fan of Elon Musk, I do think it's a mistake to discount his ability to keep running with the ball into the endzone with disruptive innovations that, while costly in the near term, could prove revolutionary over the longer term.

Tesla's Top Two Growth Drivers Are Still Humming Along

For a stock that's fallen significantly, I'd expect the growth narrative to have been severely impacted. Tesla's latest quarterly earnings results were not incredible. Yet, I do think that the sell-off is mostly a mere correction to make up for the euphoric melt-up experienced in the back half of last year. Indeed, investors got too far ahead of themselves when it came to Tesla's most ambitious growth drivers. Now that investors are taking a step back, we'll have to wait and see if Tesla can advance such drivers meaningfully.",2025-10-21
"Market Collapsed 23% 38 Years Ago, Would Be 11,000 Points Today","I watched it happen. On October 19, 1987, the Dow Jones Industrial Average tumbled 508 points, which was 22.6%. It fell from 2,246.74 at the open to 1,738.74 at the close on the day known as Black Monday. Such a drop would be just shy of 11,000 points today. The market was actually worse than that when taken over two days. The Dow had dropped almost 5% the Friday before. The anxiety over the weekend between the two was terrific.

Just before the retreat, there was a concern about U.S. trade deficits. Congress had just begun to talk about whether M&A activity had tax rates that were too low. Interest rates had been rising. However, the primary cause was wider. Many traders believed that the market was too expensive. Famous economist Robert Shiller thought, according to the University of Chicago, the explanation for the drop was that ""the crash was as much a sociological or psychological phenomenon as an economic one.""

The overvaluation explanation was based on factors that are somewhat like the current market situation. The value of the Dow rose 67% from January 1985 to the middle of 1987. Over our most recent three years, it is up about 57%.

The primary question about whether the market will drop sharply today will not be measured by the Dow. That yardstick is too narrow now. The S&P 500 is a much better metric. And, within the S&P 500, the Magnificent 7 stocks (Alphabet, Amazon, Apple, Meta Platforms, Microsoft, Nvidia, and Tesla) are 34% of the entire value of the index.

There are already cracks in the valuations of the seven stocks. This is certainly true of Apple Inc. (NASDAQ: AAPL), the price of which is only up 2% this year. This is largely because it does not have a high-end artificial intelligence product, while the valuation of AI-based companies is soaring. Tesla Inc. (NASDAQ: TSLA) has also been a laggard. It is up 9% this year, to some extent because of the political leanings of CEO Elon Musk. Additionally, there is a debate about whether Tesla is a car company or an AI and robotics operation.

At the absolute core of the value of the world's most valuable stocks is the future of AI. The earnings of Nvidia, Microsoft, Meta, Amazon, and Alphabet are based almost entirely on whether their bets on AI are correct. Each has already said it will spend tens of billions of dollars on AI data centers this year and next. At the core of the value premise today is whether AI is a product people will pay for or one that is given away almost entirely for free.

Early answers about the future of AI will be part of the earnings and forecasts for the third quarter of this year. If these are shaky, the market will rest downward, perhaps by a staggering amount.",2025-10-21
"Wedbush Stays Bullish on Tesla (TSLA), Sees Positivity Ahead of Q3 Results","Tesla, Inc. (NASDAQ:TSLA) is one of the AI Stocks Making Moves on Wall Street. On October 20, Wedbush reiterated the stock as ""Outperform"" with a $600 price target. The firm said it's sticking with Tesla ahead of earnings later this week.

""This Wednesday after the bell Tesla will report its FY3Q25 earnings with incremental positivity around this quarter's results with the deliveries beat led by some pull-forward EV demand (US tax credit ending) and a relative bounce back in China sales.""

Tesla, Inc. (NASDAQ:TSLA) is an automotive and clean energy company that leverages advanced artificial intelligence in its autonomous driving technology and robotics initiatives.

david-von-diemar-ZBWn5DvO0hg-unsplash While we acknowledge the potential of TSLA as an investment, we believe certain AI stocks offer greater upside potential and carry less downside risk. If you're looking for an extremely undervalued AI stock that also stands to benefit significantly from Trump-era tariffs and the onshoring trend, see our free report on the best short-term AI stock. READ NEXT: 10 AI Stocks Analysts Are Watching Closely and 10 AI Stocks in the Spotlight This Week Disclosure: None.",2025-10-21
GM Soars Most in Five Years as Truck Demand Spurs Outlook Boost,"(Bloomberg) -- General Motors Co.'s shares jumped the most since 2020 -- and reached the highest levels since it emerged from bankruptcy about a decade before that -- after the automaker raised its profit guidance on buoyant truck sales and a dose of tariff relief.

Six months after pulling its full-year forecast over uncertainty about the Trump administration's tariffs, GM said Tuesday it now expects to make $12 billion to $13 billion in adjusted earnings before interest and taxes in 2025 -- up from a previous range of $10 billion to $12.5 billion it had affirmed in July.

Most Read from Bloomberg

The improved outlook comes as GM is seeing a jump in sales of high-margin, gas-powered SUVs and trucks partly enabled by moves to ease federal emissions rules. Even so, the projection is below its initial guidance in January for as much as $15.7 billion, a sign of the toll taken by the imposition of tariffs and an erosion of its electric vehicle business.

In a letter to shareholders and on a conference call with analysts, Chief Executive Officer Mary Barra thanked President Donald Trump for extending through 2030 a tariff discount on some imports for carmakers that produce and sell completed automobiles in the US.

""We appreciate the administration's ongoing support for American innovation and jobs, and we look forward to progress on trade deals with countries like Canada and Mexico,"" she said on the call.

Shares of the Detroit-based manufacturer rose 15%, the best one-day gain since March 2020, to close regular trading at a record $66.62. The stock is up about 25% this year, ahead of a 15% gain so far in the broader S&P 500 index.

Chris McNally, an analyst at Evercore with an ""outperform"" on GM, highlighted the company's prediction next year's earnings may be even stronger than in 2025, signaling bullish momentum. ""Not sure what anyone could possibly even nitpick about this,"" he said in a research note.

The forecast shows how GM is managing disruption from the White House in areas ranging from emission penalties and electric vehicle subsidies to levies on imports of components and vehicles. Those changes have hurt profits and further undercut an already wavering initiative to electrify GM's fleet by 2035 in a bid to better compete with Tesla Inc. and fast-growing Chinese rivals. Earlier this month, GM said it booked a one-time charge of $1.6 billion to restructure its struggling EV business.",2025-10-21
GM Soars Most in Five Years as Truck Demand Spurs Outlook Boost,"(Bloomberg) -- General Motors Co.'s shares jumped the most since 2020 -- and reached the highest levels since it emerged from bankruptcy about a decade before that -- after the automaker raised its profit guidance on buoyant truck sales and a dose of tariff relief.

Six months after pulling its full-year forecast over uncertainty about the Trump administration's tariffs, GM said Tuesday it now expects to make $12 billion to $13 billion in adjusted earnings before interest and taxes in 2025 -- up from a previous range of $10 billion to $12.5 billion it had affirmed in July.

Most Read from Bloomberg

The improved outlook comes as GM is seeing a jump in sales of high-margin, gas-powered SUVs and trucks partly enabled by moves to ease federal emissions rules. Even so, the projection is below its initial guidance in January for as much as $15.7 billion, a sign of the toll taken by the imposition of tariffs and an erosion of its electric vehicle business.

In a letter to shareholders and on a conference call with analysts, Chief Executive Officer Mary Barra thanked President Donald Trump for extending through 2030 a tariff discount on some imports for carmakers that produce and sell completed automobiles in the US.

""We appreciate the administration's ongoing support for American innovation and jobs, and we look forward to progress on trade deals with countries like Canada and Mexico,"" she said on the call.

Shares of the Detroit-based manufacturer rose 15%, the best one-day gain since March 2020, to close regular trading at a record $66.62. The stock is up about 25% this year, ahead of a 15% gain so far in the broader S&P 500 index.

Chris McNally, an analyst at Evercore with an ""outperform"" on GM, highlighted the company's prediction next year's earnings may be even stronger than in 2025, signaling bullish momentum. ""Not sure what anyone could possibly even nitpick about this,"" he said in a research note.

The forecast shows how GM is managing disruption from the White House in areas ranging from emission penalties and electric vehicle subsidies to levies on imports of components and vehicles. Those changes have hurt profits and further undercut an already wavering initiative to electrify GM's fleet by 2035 in a bid to better compete with Tesla Inc. and fast-growing Chinese rivals. Earlier this month, GM said it booked a one-time charge of $1.6 billion to restructure its struggling EV business.",2025-10-21
GM Soars Most in Five Years as Truck Demand Spurs Outlook Boost,"(Bloomberg) -- General Motors Co.'s shares jumped the most since 2020 -- and reached the highest levels since it emerged from bankruptcy about a decade before that -- after the automaker raised its profit guidance on buoyant truck sales and a dose of tariff relief.

Six months after pulling its full-year forecast over uncertainty about the Trump administration's tariffs, GM said Tuesday it now expects to make $12 billion to $13 billion in adjusted earnings before interest and taxes in 2025 -- up from a previous range of $10 billion to $12.5 billion it had affirmed in July.

Most Read from Bloomberg

The improved outlook comes as GM is seeing a jump in sales of high-margin, gas-powered SUVs and trucks partly enabled by moves to ease federal emissions rules. Even so, the projection is below its initial guidance in January for as much as $15.7 billion, a sign of the toll taken by the imposition of tariffs and an erosion of its electric vehicle business.

In a letter to shareholders and on a conference call with analysts, Chief Executive Officer Mary Barra thanked President Donald Trump for extending through 2030 a tariff discount on some imports for carmakers that produce and sell completed automobiles in the US.

""We appreciate the administration's ongoing support for American innovation and jobs, and we look forward to progress on trade deals with countries like Canada and Mexico,"" she said on the call.

Shares of the Detroit-based manufacturer rose 15%, the best one-day gain since March 2020, to close regular trading at a record $66.62. The stock is up about 25% this year, ahead of a 15% gain so far in the broader S&P 500 index.

Chris McNally, an analyst at Evercore with an ""outperform"" on GM, highlighted the company's prediction next year's earnings may be even stronger than in 2025, signaling bullish momentum. ""Not sure what anyone could possibly even nitpick about this,"" he said in a research note.

The forecast shows how GM is managing disruption from the White House in areas ranging from emission penalties and electric vehicle subsidies to levies on imports of components and vehicles. Those changes have hurt profits and further undercut an already wavering initiative to electrify GM's fleet by 2035 in a bid to better compete with Tesla Inc. and fast-growing Chinese rivals. Earlier this month, GM said it booked a one-time charge of $1.6 billion to restructure its struggling EV business.",2025-10-21
"Wedbush Stays Bullish on Tesla (TSLA), Sees Positivity Ahead of Q3 Results","Tesla, Inc. (NASDAQ:TSLA) is one of the AI Stocks Making Moves on Wall Street. On October 20, Wedbush reiterated the stock as ""Outperform"" with a $600 price target. The firm said it's sticking with Tesla ahead of earnings later this week.

""This Wednesday after the bell Tesla will report its FY3Q25 earnings with incremental positivity around this quarter's results with the deliveries beat led by some pull-forward EV demand (US tax credit ending) and a relative bounce back in China sales.""

Tesla, Inc. (NASDAQ:TSLA) is an automotive and clean energy company that leverages advanced artificial intelligence in its autonomous driving technology and robotics initiatives.

david-von-diemar-ZBWn5DvO0hg-unsplash While we acknowledge the potential of TSLA as an investment, we believe certain AI stocks offer greater upside potential and carry less downside risk. If you're looking for an extremely undervalued AI stock that also stands to benefit significantly from Trump-era tariffs and the onshoring trend, see our free report on the best short-term AI stock. READ NEXT: 10 AI Stocks Analysts Are Watching Closely and 10 AI Stocks in the Spotlight This Week Disclosure: None.",2025-10-21
