title,content,publishedAt
"Crewe Advisors LLC Raises Stock Holdings in Tesla, Inc. $TSLA","Crewe Advisors LLC raised its stake in Tesla, Inc. (NASDAQ:TSLA - Free Report) by 0.1% in the 2nd quarter, Holdings Channel.com reports. The firm owned 44,283 shares of the electric vehicle producer's stock after acquiring an additional 53 shares during the period. Tesla makes up 2.0% of Crewe Advisors LLC's holdings, making the stock its 16th biggest holding. Crewe Advisors LLC's holdings in Tesla were worth $14,067,000 as of its most recent filing with the SEC.

Other hedge funds have also recently added to or reduced their stakes in the company. First PREMIER Bank increased its position in Tesla by 79.2% in the 1st quarter. First PREMIER Bank now owns 95 shares of the electric vehicle producer's stock valued at $25,000 after acquiring an additional 42 shares during the period. Arcadia Investment Management Corp MI acquired a new position in shares of Tesla in the 1st quarter valued at about $27,000. Chelsea Counsel Co. increased its stake in shares of Tesla by 59.7% in the first quarter. Chelsea Counsel Co. now owns 107 shares of the electric vehicle producer's stock worth $28,000 after acquiring an additional 40 shares during the last quarter. Centennial Bank AR raised its stake in shares of Tesla by 833.3% during the 1st quarter. Centennial Bank AR now owns 112 shares of the electric vehicle producer's stock worth $29,000 after purchasing an additional 100 shares in the last quarter. Finally, Compass Wealth Management LLC raised its position in Tesla by 360.0% during the first quarter. Compass Wealth Management LLC now owns 115 shares of the electric vehicle producer's stock valued at $30,000 after acquiring an additional 90 shares in the last quarter. Institutional investors and hedge funds own 66.20% of the company's stock.

Get Tesla alerts: Insider Buying and Selling

In other Tesla news, Director James R. Murdoch sold 60,000 shares of the company's stock in a transaction that occurred on Monday, September 15th. The stock was sold at an average price of $422.68, for a total value of $25,360,800.00. Following the completion of the transaction, the director owned 637,031 shares of the company's stock, valued at $269,260,263.08. This represents a 8.61% decrease in their position. The transaction was disclosed in a legal filing with the SEC, which is available at this link. Also, CFO Vaibhav Taneja sold 2,606 shares of Tesla stock in a transaction that occurred on Monday, September 8th. The stock was sold at an average price of $352.38, for a total value of $918,302.28. Following the sale, the chief financial officer directly owned 9,856 shares in the company, valued at $3,473,057.28. The trade was a 20.91% decrease in their position. The disclosure for this sale can be found here. Insiders have sold a total of 202,606 shares of company stock valued at $75,588,902 over the last three months. 19.90% of the stock is owned by corporate insiders.

Wall Street Analysts Forecast Growth

TSLA has been the topic of several analyst reports. Barclays reissued a ""negative"" rating and set a $350.00 target price (up from $275.00) on shares of Tesla in a research report on Thursday. Morgan Stanley reiterated an ""overweight"" rating on shares of Tesla in a research note on Wednesday. TD Cowen raised their price objective on Tesla from $374.00 to $509.00 and gave the company a ""buy"" rating in a research note on Thursday, October 9th. Baird R W raised Tesla from a ""hold"" rating to a ""strong-buy"" rating in a research report on Friday, September 19th. Finally, The Goldman Sachs Group increased their price target on Tesla from $395.00 to $425.00 and gave the company a ""neutral"" rating in a report on Friday, October 3rd. Two research analysts have rated the stock with a Strong Buy rating, twenty-one have assigned a Buy rating, twelve have issued a Hold rating and ten have given a Sell rating to the company's stock. According to MarketBeat, the stock currently has an average rating of ""Hold"" and a consensus target price of $363.54.

View Our Latest Research Report on TSLA

Tesla Trading Up 2.5%

Shares of Tesla stock opened at $439.31 on Monday. The company has a market cap of $1.46 trillion, a price-to-earnings ratio of 253.94, a PEG ratio of 15.79 and a beta of 2.08. Tesla, Inc. has a 1 year low of $212.11 and a 1 year high of $488.54. The company's fifty day simple moving average is $387.54 and its 200-day simple moving average is $334.06. The company has a current ratio of 2.04, a quick ratio of 1.55 and a debt-to-equity ratio of 0.07.

Tesla (NASDAQ:TSLA - Get Free Report) last issued its quarterly earnings results on Wednesday, July 23rd. The electric vehicle producer reported $0.40 earnings per share for the quarter, missing analysts' consensus estimates of $0.43 by ($0.03). Tesla had a net margin of 6.54% and a return on equity of 7.98%. The company had revenue of $22.50 billion during the quarter, compared to the consensus estimate of $23.18 billion. During the same period last year, the company earned $0.52 earnings per share. Tesla's revenue for the quarter was down 11.8% on a year-over-year basis. As a group, sell-side analysts expect that Tesla, Inc. will post 2.56 EPS for the current year.

Tesla Profile

(Free Report)

Tesla, Inc designs, develops, manufactures, leases, and sells electric vehicles, and energy generation and storage systems in the United States, China, and internationally. The company operates in two segments, Automotive, and Energy Generation and Storage. The Automotive segment offers electric vehicles, as well as sells automotive regulatory credits; and non-warranty after-sales vehicle, used vehicles, body shop and parts, supercharging, retail merchandise, and vehicle insurance services.

Featured Articles Five stocks we like better than Tesla Election Stocks: How Elections Affect the Stock Market JPMorgan Crushes Q3; But Is the Steady Eddy Stock Hitting A Wall? Health Care Stocks Explained: Why You Might Want to Invest Snap-on Incorporated: Snap It Up Quick, New Highs Will Come Soon What Are the U.K. Market Holidays? How to Invest and Trade As Global Renewables Surpass Coal, This ETF Offers Smart Exposure

Want to see what other hedge funds are holding TSLA? Visit HoldingsChannel.com to get the latest 13F filings and insider trades for Tesla, Inc. (NASDAQ:TSLA - Free Report).

Receive News & Ratings for Tesla Daily - Enter your email address below to receive a concise daily summary of the latest news and analysts' ratings for Tesla and related companies with MarketBeat.com's FREE daily email newsletter.",2025-10-20
"Top Stocks With Earnings This Week: Tesla, Netflix, RTX and More - Tesla (NASDAQ:TSLA)","Earnings Playbook for the Week Ahead

Retail investors are preparing for the first busy week in the third-quarter earnings season, with major defense contractors and other top stocks reporting.

Here's a look at some retail favorites that individual investors will be watching.

TSLA stock is moving. See the real-time price action here. Monday, Oct. 20Before Market Open

Cleveland-Cliffs Inc. (NYSE:CLF) and Summit Therapeutics Inc. (NASDAQ:SMMT) will kick off the week with their earnings releases before Monday's opening bell.

Read Next: Move Over, Musk -- The World's Richest Woman Joined the $100B Club

After Market Close

AGNC Investment Corp. (NASDAQ:AGNC) and Zions Bancorporation N.A. (NASDAQ:ZION) are set to report following Monday's closing bell.

Tuesday, Oct. 21Before Market Open

Several major government contractors will report before the market opens on Tuesday, including GE Aerospace (NYSE:GE), Lockheed Martin Corp. (NYSE:LMT), RTX Corp. (NYSE:RTX) and Halliburton Co. (NYSE:HAL)

One of the Big Three automakers General Motors Co. (NYSE:GM) is set to report before Tuesday's opening bell. Analysts expect the company to report earnings of $2.31 per share and revenue of $45.27 billion, according to data from Benzinga Pro.

Tuesday morning will also feature releases from The Coca-Cola Co. (NYSE:KO), 3M Co. (NYSE:MMM) and Galaxy Digital Holdings Ltd. (NASDAQ:GLXY).

After Market Close

Streaming giant Netflix Inc. (NASDAQ:NFLX) is set to release its Q3 earnings report after Tuesday's closing bell. The Street is looking for earnings $6.97 per share on revenue of $11.51 billion for the quarter.

Intuitive Surgical Inc. (NASDAQ:ISRG) and Texas Instruments Inc. (NASDAQ:TXN) will also report after Tuesday's market close.

Read Next: USA Rare Earth, Critical Metals Stocks Explode -- JPMorgan Adds Fuel To The Fire

Wednesday, Oct. 22Before Market Open

AT&T Inc. (NYSE:T) and Vertiv Holdings Co. (NYSE:VRT) are set to report ahead of Wednesday's opening bell.

After Market Close

Elon Musk's Tesla Inc. (NASDAQ:TSLA) is the biggest name reporting after the close on Wednesday. Analysts expect the EV maker to report quarterly earnings of 53 cents per share on revenue of $26.16 billion.

Investors will be watching for updates on new vehicle models, progress with the Robotaxi initiative and commentary on sales momentum following the expiration of EV tax credits.

QuantumScape Corp. (NYSE:QS) is another retail darling that will report after the closing bell along with International Business Machines Corp. (NYSE:IBM), Southwest Airlines Co. (NYSE:LUV) and Viking Therapeutics Inc. (NASDAQ:VKTX).

Thursday, Oct. 23Before Market Open

American Airlines Group Inc. (NASDAQ:AAL), Nokia Corp. (NYSE:NOK), Mobileye Global Inc. (NASDAQ:MBLY) and Valero Energy Corp. (NYSE:VLO) will report before the opening on Thursday.

After Market Close

Intel Corp. (NASDAQ:INTC) will likely be the most-watched report coming after Thursday's closing bell.

The market will focus on updates to Intel's AI and foundry strategies, with Wall Street sentiment cautious due to persistent production delays and recent business shifts despite strong stock performance following investment from the federal government.

Ford Motor Co. (NYSE:F) and Alaska Air Group Inc. (NYSE:ALK) will also report after Thursday's market close.

Friday, Oct. 24Before Market Open

Procter & Gamble Co. (NYSE:PG), General Dynamics Corp. (NYSE:GD) , and HCA Healthcare Inc. (NYSE:HCA) will close out the week, all reporting before Friday's opening bell.

Read Next:

Rigetti, D-Wave, IonQ Could Get JPMorgan's Support -- Quantum Stocks Take Off

Photo: Shutterstock

TSLATesla Inc$443.500.95%OverviewAALAmerican Airlines Group Inc$11.930.59%AGNCAGNC Investment Corp$10.000.10%ALKAlaska Air Group Inc$47.480.36%CLFCleveland-Cliffs Inc$14.8411.4%FFord Motor Co$11.930.08%GDGeneral Dynamics Corp$331.15-%GEGE Aerospace$302.410.76%GLXYGalaxy Digital Inc$39.324.08%GMGeneral Motors Co$58.450.12%HALHalliburton Co$22.360.40%HCAHCA Healthcare Inc$426.00-0.04%IBMInternational Business Machines Corp$282.750.52%INTCIntel Corp$37.661.76%ISRGIntuitive Surgical Inc$452.001.32%KOCoca-Cola Co$68.24-0.29%LMTLockheed Martin Corp$496.480.27%LUVSouthwest Airlines Co$33.610.27%MBLYMobileye Global Inc$14.160.93%MMM3M Co$152.750.07%NFLXNetflix Inc$1200.750.12%NOKNokia Oyj$5.71-0.52%PGProcter & Gamble Co$151.40-%QSQuantumScape Corp$15.984.03%RTXRTX Corp$158.580.40%SMMTSummit Therapeutics Inc$19.70-6.15%TAT&T Inc$26.32-0.08%TXNTexas Instruments Inc$174.48-1.19%VKTXViking Therapeutics Inc$33.951.24%VLOValero Energy Corp$158.200.27%VRTVertiv Holdings Co$177.111.79%ZIONZions Bancorp NA$50.551.77%Market News and Data brought to you by Benzinga APIs",2025-10-20
"Schnieders Capital Management LLC Purchases 4,406 Shares of Tesla, Inc. $TSLA","Schnieders Capital Management LLC grew its holdings in shares of Tesla, Inc. (NASDAQ:TSLA - Free Report) by 94.2% in the second quarter, Holdings Channel.com reports. The firm owned 9,085 shares of the electric vehicle producer's stock after buying an additional 4,406 shares during the period. Schnieders Capital Management LLC's holdings in Tesla were worth $2,886,000 as of its most recent filing with the Securities & Exchange Commission.

Several other hedge funds and other institutional investors also recently modified their holdings of the business. First PREMIER Bank grew its position in shares of Tesla by 79.2% in the first quarter. First PREMIER Bank now owns 95 shares of the electric vehicle producer's stock valued at $25,000 after purchasing an additional 42 shares in the last quarter. Arcadia Investment Management Corp MI purchased a new position in Tesla during the 1st quarter valued at about $27,000. Chelsea Counsel Co. increased its position in shares of Tesla by 59.7% during the first quarter. Chelsea Counsel Co. now owns 107 shares of the electric vehicle producer's stock valued at $28,000 after buying an additional 40 shares during the period. Evergreen Private Wealth LLC lifted its holdings in shares of Tesla by 270.0% in the second quarter. Evergreen Private Wealth LLC now owns 111 shares of the electric vehicle producer's stock worth $35,000 after buying an additional 81 shares in the last quarter. Finally, Centennial Bank AR boosted its position in shares of Tesla by 833.3% in the first quarter. Centennial Bank AR now owns 112 shares of the electric vehicle producer's stock valued at $29,000 after acquiring an additional 100 shares during the period. Institutional investors own 66.20% of the company's stock.

Get Tesla alerts: Analyst Upgrades and Downgrades

A number of analysts recently weighed in on TSLA shares. Cantor Fitzgerald reaffirmed an ""overweight"" rating and set a $355.00 target price on shares of Tesla in a report on Friday, October 3rd. Stifel Nicolaus set a $483.00 price target on shares of Tesla and gave the stock a ""buy"" rating in a report on Wednesday, October 8th. Melius assumed coverage on Tesla in a research report on Monday, October 13th. They issued a ""buy"" rating and a $520.00 price objective on the stock. The Goldman Sachs Group boosted their target price on Tesla from $395.00 to $425.00 and gave the stock a ""neutral"" rating in a research report on Friday, October 3rd. Finally, William Blair restated a ""market perform"" rating on shares of Tesla in a research note on Friday, September 5th. Two equities research analysts have rated the stock with a Strong Buy rating, twenty-one have assigned a Buy rating, twelve have given a Hold rating and ten have assigned a Sell rating to the company's stock. According to MarketBeat, Tesla presently has an average rating of ""Hold"" and an average price target of $363.54.

View Our Latest Analysis on Tesla Tesla Trading Up 2.5%

NASDAQ TSLA opened at $439.31 on Monday. The company has a quick ratio of 1.55, a current ratio of 2.04 and a debt-to-equity ratio of 0.07. The stock's 50-day simple moving average is $387.54 and its two-hundred day simple moving average is $334.06. Tesla, Inc. has a twelve month low of $212.11 and a twelve month high of $488.54. The company has a market capitalization of $1.46 trillion, a price-to-earnings ratio of 253.94, a PEG ratio of 15.79 and a beta of 2.08.

Tesla (NASDAQ:TSLA - Get Free Report) last posted its quarterly earnings data on Wednesday, July 23rd. The electric vehicle producer reported $0.40 earnings per share (EPS) for the quarter, missing analysts' consensus estimates of $0.43 by ($0.03). The firm had revenue of $22.50 billion during the quarter, compared to analysts' expectations of $23.18 billion. Tesla had a return on equity of 7.98% and a net margin of 6.54%.Tesla's revenue for the quarter was down 11.8% compared to the same quarter last year. During the same quarter in the previous year, the company posted $0.52 earnings per share. Research analysts forecast that Tesla, Inc. will post 2.56 EPS for the current fiscal year.

Insider Buying and Selling at Tesla

In related news, SVP Xiaotong Zhu sold 20,000 shares of the stock in a transaction on Thursday, September 11th. The shares were sold at an average price of $363.75, for a total transaction of $7,275,000.00. Following the transaction, the senior vice president owned 47,600 shares of the company's stock, valued at approximately $17,314,500. This trade represents a 29.59% decrease in their position. The transaction was disclosed in a document filed with the Securities & Exchange Commission, which is accessible through this link. Also, Director James R. Murdoch sold 120,000 shares of the business's stock in a transaction on Tuesday, August 26th. The stock was sold at an average price of $350.29, for a total transaction of $42,034,800.00. Following the completion of the sale, the director directly owned 697,031 shares of the company's stock, valued at $244,162,988.99. This represents a 14.69% decrease in their ownership of the stock. The disclosure for this sale can be found here. Insiders have sold 202,606 shares of company stock worth $75,588,902 over the last ninety days. Insiders own 19.90% of the company's stock.

Tesla Profile

(Free Report)

Tesla, Inc designs, develops, manufactures, leases, and sells electric vehicles, and energy generation and storage systems in the United States, China, and internationally. The company operates in two segments, Automotive, and Energy Generation and Storage. The Automotive segment offers electric vehicles, as well as sells automotive regulatory credits; and non-warranty after-sales vehicle, used vehicles, body shop and parts, supercharging, retail merchandise, and vehicle insurance services.

Featured Stories Five stocks we like better than Tesla 5 Top Rated Dividend Stocks to Consider JPMorgan Crushes Q3; But Is the Steady Eddy Stock Hitting A Wall? Growth Stocks: What They Are, What They Are Not Snap-on Incorporated: Snap It Up Quick, New Highs Will Come Soon Are These Liquid Natural Gas Stocks Ready For An Upside Bounce? As Global Renewables Surpass Coal, This ETF Offers Smart Exposure

Want to see what other hedge funds are holding TSLA? Visit HoldingsChannel.com to get the latest 13F filings and insider trades for Tesla, Inc. (NASDAQ:TSLA - Free Report).

Receive News & Ratings for Tesla Daily - Enter your email address below to receive a concise daily summary of the latest news and analysts' ratings for Tesla and related companies with MarketBeat.com's FREE daily email newsletter.",2025-10-20
"Canvas Wealth Advisors LLC Boosts Stake in Tesla, Inc. $TSLA","Canvas Wealth Advisors LLC raised its holdings in shares of Tesla, Inc. (NASDAQ:TSLA - Free Report) by 3.1% in the 2nd quarter, according to its most recent Form 13F filing with the Securities and Exchange Commission (SEC). The firm owned 40,255 shares of the electric vehicle producer's stock after buying an additional 1,217 shares during the period. Tesla comprises approximately 2.6% of Canvas Wealth Advisors LLC's investment portfolio, making the stock its 13th biggest position. Canvas Wealth Advisors LLC's holdings in Tesla were worth $13,107,000 at the end of the most recent quarter.

Other hedge funds and other institutional investors have also recently modified their holdings of the company. First PREMIER Bank lifted its position in shares of Tesla by 79.2% during the first quarter. First PREMIER Bank now owns 95 shares of the electric vehicle producer's stock worth $25,000 after purchasing an additional 42 shares during the last quarter. Arcadia Investment Management Corp MI purchased a new position in Tesla in the 1st quarter worth about $27,000. Chelsea Counsel Co. lifted its holdings in Tesla by 59.7% during the 1st quarter. Chelsea Counsel Co. now owns 107 shares of the electric vehicle producer's stock valued at $28,000 after buying an additional 40 shares in the last quarter. Evergreen Private Wealth LLC boosted its position in Tesla by 270.0% in the 2nd quarter. Evergreen Private Wealth LLC now owns 111 shares of the electric vehicle producer's stock valued at $35,000 after buying an additional 81 shares during the period. Finally, Centennial Bank AR grew its stake in Tesla by 833.3% in the 1st quarter. Centennial Bank AR now owns 112 shares of the electric vehicle producer's stock worth $29,000 after acquiring an additional 100 shares in the last quarter. 66.20% of the stock is currently owned by hedge funds and other institutional investors.

Get Tesla alerts: Tesla Trading Up 2.5%

Shares of NASDAQ TSLA opened at $439.31 on Monday. Tesla, Inc. has a 1-year low of $212.11 and a 1-year high of $488.54. The business has a fifty day moving average price of $387.54 and a 200 day moving average price of $334.06. The stock has a market capitalization of $1.46 trillion, a P/E ratio of 253.94, a price-to-earnings-growth ratio of 15.79 and a beta of 2.08. The company has a debt-to-equity ratio of 0.07, a current ratio of 2.04 and a quick ratio of 1.55.

Tesla (NASDAQ:TSLA - Get Free Report) last announced its earnings results on Wednesday, July 23rd. The electric vehicle producer reported $0.40 EPS for the quarter, missing analysts' consensus estimates of $0.43 by ($0.03). Tesla had a return on equity of 7.98% and a net margin of 6.54%.The firm had revenue of $22.50 billion during the quarter, compared to the consensus estimate of $23.18 billion. During the same quarter in the prior year, the firm posted $0.52 earnings per share. The business's revenue for the quarter was down 11.8% compared to the same quarter last year. Equities research analysts expect that Tesla, Inc. will post 2.56 EPS for the current fiscal year. Analysts Set New Price Targets

Several research firms have recently weighed in on TSLA. Morgan Stanley reaffirmed an ""overweight"" rating on shares of Tesla in a research note on Wednesday. Royal Bank Of Canada lifted their target price on Tesla from $325.00 to $500.00 and gave the company an ""outperform"" rating in a research report on Friday, October 10th. Deutsche Bank Aktiengesellschaft upped their target price on Tesla from $345.00 to $435.00 and gave the stock a ""buy"" rating in a report on Friday, September 26th. Baird R W upgraded Tesla from a ""hold"" rating to a ""strong-buy"" rating in a research note on Friday, September 19th. Finally, The Goldman Sachs Group upped their price objective on shares of Tesla from $395.00 to $425.00 and gave the stock a ""neutral"" rating in a research note on Friday, October 3rd. Two analysts have rated the stock with a Strong Buy rating, twenty-one have given a Buy rating, twelve have given a Hold rating and ten have given a Sell rating to the company. According to data from MarketBeat.com, Tesla currently has a consensus rating of ""Hold"" and a consensus target price of $363.54.

View Our Latest Stock Analysis on TSLA

Insider Buying and Selling at Tesla

In other Tesla news, Director James R. Murdoch sold 60,000 shares of Tesla stock in a transaction on Monday, September 15th. The shares were sold at an average price of $422.68, for a total value of $25,360,800.00. Following the transaction, the director directly owned 637,031 shares of the company's stock, valued at approximately $269,260,263.08. The trade was a 8.61% decrease in their ownership of the stock. The transaction was disclosed in a document filed with the Securities & Exchange Commission, which can be accessed through the SEC website. Also, SVP Xiaotong Zhu sold 20,000 shares of the stock in a transaction on Thursday, September 11th. The shares were sold at an average price of $363.75, for a total value of $7,275,000.00. Following the sale, the senior vice president owned 47,600 shares of the company's stock, valued at approximately $17,314,500. This represents a 29.59% decrease in their position. The disclosure for this sale can be found here. Insiders sold a total of 202,606 shares of company stock worth $75,588,902 over the last three months. Corporate insiders own 19.90% of the company's stock.

Tesla Profile

(Free Report)

Tesla, Inc designs, develops, manufactures, leases, and sells electric vehicles, and energy generation and storage systems in the United States, China, and internationally. The company operates in two segments, Automotive, and Energy Generation and Storage. The Automotive segment offers electric vehicles, as well as sells automotive regulatory credits; and non-warranty after-sales vehicle, used vehicles, body shop and parts, supercharging, retail merchandise, and vehicle insurance services.

Read More Five stocks we like better than Tesla Should You Invest in Penny Stocks? JPMorgan Crushes Q3; But Is the Steady Eddy Stock Hitting A Wall? What is a support level? Snap-on Incorporated: Snap It Up Quick, New Highs Will Come Soon Stock Market Upgrades: What Are They? As Global Renewables Surpass Coal, This ETF Offers Smart Exposure

Want to see what other hedge funds are holding TSLA? Visit HoldingsChannel.com to get the latest 13F filings and insider trades for Tesla, Inc. (NASDAQ:TSLA - Free Report).

Receive News & Ratings for Tesla Daily - Enter your email address below to receive a concise daily summary of the latest news and analysts' ratings for Tesla and related companies with MarketBeat.com's FREE daily email newsletter.",2025-10-20
